id,guid,link,pubdate,author,title,description,source,user_id,profile_image_url,user_statuses_count,user_friends_count,user_followers_count,user_created_at,user_bio,user_location,lang,coords,
512,"https://twitter.com/EdilesCanelones/statuses/1273040328468152320","https://twitter.com/EdilesCanelones/statuses/1273040328468152320","2020-06-16 19:50:40","EdilesCanelones","RT @Eliana67919239: #RIVERA #URUGUAY  EL PRESIDENTE DE ASSE ÉL @LeoCipriani20 CUMPLIENDO CON SU COMPROMISO  POR EL COVID-19  Se enviaron 10…","#RIVERA #URUGUAY  EL PRESIDENTE DE ASSE ÉL @LeoCipriani20 CUMPLIENDO CON SU COMPROMISO  POR EL COVID-19  Se enviaron 100.000 mil tapa bocas para la población ante la emergencia sanitaria que vive por el covid-19, y ya llegaron a rivera. @ASSEcomunica @tartagliaestefa https://t.co/dTptcOItuh","Twitter for iPhone",3570521663,"https://pbs.twimg.com/profile_images/1257262566650318855/Ui9zKG9r_normal.jpg",25353,4953,3721,"2015-09-06 18:20:42","Ediles de Canelones del Partido Nacional .","Canelones, Uruguay","es","","","","","","","","","","","","","","","","","","","","",
513,"https://twitter.com/otrocanelones/statuses/1273040130815787009","https://twitter.com/otrocanelones/statuses/1273040130815787009","2020-06-16 19:49:53","otrocanelones","RT @Eliana67919239: #RIVERA #URUGUAY  EL PRESIDENTE DE ASSE ÉL @LeoCipriani20 CUMPLIENDO CON SU COMPROMISO  POR EL COVID-19  Se enviaron 10…","#RIVERA #URUGUAY  EL PRESIDENTE DE ASSE ÉL @LeoCipriani20 CUMPLIENDO CON SU COMPROMISO  POR EL COVID-19  Se enviaron 100.000 mil tapa bocas para la población ante la emergencia sanitaria que vive por el covid-19, y ya llegaron a rivera. @ASSEcomunica @tartagliaestefa https://t.co/dTptcOItuh","Twitter for iPhone",738906282283962368,"https://pbs.twimg.com/profile_images/1231997796003217408/C5oNz3kg_normal.jpg",17037,659,1908,"2016-06-03 21:32:40","#otrocanelones                                                                       Lo nuestro es estar cerca del mas necesitado.","Canelones, Uruguay","es","","","","","","","","","","","","","","","","","","","","",
514,"https://twitter.com/HerrerismoLP/statuses/1273039950561390593","https://twitter.com/HerrerismoLP/statuses/1273039950561390593","2020-06-16 19:49:10","HerrerismoLP","RT @Eliana67919239: #RIVERA #URUGUAY  EL PRESIDENTE DE ASSE ÉL @LeoCipriani20 CUMPLIENDO CON SU COMPROMISO  POR EL COVID-19  Se enviaron 10…","#RIVERA #URUGUAY  EL PRESIDENTE DE ASSE ÉL @LeoCipriani20 CUMPLIENDO CON SU COMPROMISO  POR EL COVID-19  Se enviaron 100.000 mil tapa bocas para la población ante la emergencia sanitaria que vive por el covid-19, y ya llegaron a rivera. @ASSEcomunica @tartagliaestefa https://t.co/dTptcOItuh","Twitter for iPhone",2206067696,"https://pbs.twimg.com/profile_images/1125383804091281409/msLliUfX_normal.jpg",31802,205,5338,"2013-11-20 20:57:19","Sector político del Partido Nacional .","Canelones, Uruguay","es","","","","","","","","","","","","","","","","","","","","",
515,"https://twitter.com/Edil_alerepetto/statuses/1273039866989645824","https://twitter.com/Edil_alerepetto/statuses/1273039866989645824","2020-06-16 19:48:50","Edil_alerepetto","RT @Eliana67919239: #RIVERA #URUGUAY  EL PRESIDENTE DE ASSE ÉL @LeoCipriani20 CUMPLIENDO CON SU COMPROMISO  POR EL COVID-19  Se enviaron 10…","#RIVERA #URUGUAY  EL PRESIDENTE DE ASSE ÉL @LeoCipriani20 CUMPLIENDO CON SU COMPROMISO  POR EL COVID-19  Se enviaron 100.000 mil tapa bocas para la población ante la emergencia sanitaria que vive por el covid-19, y ya llegaron a rivera. @ASSEcomunica @tartagliaestefa https://t.co/dTptcOItuh","Twitter for iPhone",620170961,"https://pbs.twimg.com/profile_images/1256313233213992968/gxOUVOLt_normal.jpg",25781,397,5270,"2012-06-27 13:10:44","Edil del departamento de Canelones - Partido Nacional - Lista 33 - Herrerismo","Las Piedras_Canelones_Uruguay","es","","","","","","","","","","","","","","","","","","","","",
516,"https://twitter.com/Futbox1/statuses/1273039816410705925","https://twitter.com/Futbox1/statuses/1273039816410705925","2020-06-16 19:48:38","Futbox1","Hoy está de cumpleaños de un verdadero #1, @1_Muslera_25 !🇺🇾⚽️🙌🏻  Ostenta el récord de imbatibilidad en el arco Celeste durante una Copa del Mundo.   #Futbox #fútbol #FernandoMuslera #Uruguay #Galatasaray #NacionalFootballClub https://t.co/nrTBVb8hVg","Hoy está de cumpleaños de un verdadero #1, @1_Muslera_25 !🇺🇾⚽️🙌🏻  Ostenta el récord de imbatibilidad en el arco Celeste durante una Copa del Mundo.   #Futbox #fútbol #FernandoMuslera #Uruguay #Galatasaray #NacionalFootballClub https://t.co/nrTBVb8hVg","Twitter for iPhone",1251262224263512064,"https://pbs.twimg.com/profile_images/1264390714538024960/myYIs5Ww_normal.jpg",47,103,18,"2020-04-17 17:32:45","Fans de la pelota, poco talentosos con ella, que encontraron éste espacio para profesar su amor por el juego y los colores que comprende. Disfruten.","Donde haya una pelota","es","","","","","","","","","","","","","","","","","","","","",
517,"https://twitter.com/carmen197713/statuses/1273039700010381315","https://twitter.com/carmen197713/statuses/1273039700010381315","2020-06-16 19:48:11","carmen197713","Hermoso día hoy #16deJunio2020 , un poco húmedo pero agradable ... Bello cielo de #Montevideo #Uruguay 🇺🇾 #cielo #celeste #blanco y con el ☀️🌤️🌅💙💙 https://t.co/dINO6u5EzJ","Hermoso día hoy #16deJunio2020 , un poco húmedo pero agradable ... Bello cielo de #Montevideo #Uruguay 🇺🇾 #cielo #celeste #blanco y con el ☀️🌤️🌅💙💙 https://t.co/dINO6u5EzJ","Twitter for Android",871504158964232192,"https://pbs.twimg.com/profile_images/1249566717652672512/5xevQEHq_normal.jpg",60493,3878,1155,"2017-06-04 19:09:18","La vida es una canción , la esperanza es la letra y el amor es la música.🤩🤩🎶💃","Uruguay🇺🇾","es","","","","","","","","","","","","","","","","","","","","",
518,"https://twitter.com/GeobarUruguay/statuses/1273039652195315714","https://twitter.com/GeobarUruguay/statuses/1273039652195315714","2020-06-16 19:47:59","GeobarUruguay","Mejores precios en COMIDA y BEBIDA, la mejor PIZZA y MUZZA del mundo, las MILANESAS+grandes, CHIVITOS locura, HAMBURGUESAS celestiales, la comida más rica, las bebidas+baratas, Proba Maldonado 1449 Pedidos al 092670338. #Cuba #Venezuela #Bolivia #Peru #Ecuador #Uruguay #Colombia https://t.co/m1A3pPkRSw","Mejores precios en COMIDA y BEBIDA, la mejor PIZZA y MUZZA del mundo, las MILANESAS+grandes, CHIVITOS locura, HAMBURGUESAS celestiales, la comida más rica, las bebidas+baratas, Proba Maldonado 1449 Pedidos al 092670338. #Cuba #Venezuela #Bolivia #Peru #Ecuador #Uruguay #Colombia https://t.co/m1A3pPkRSw","Twitter Web App",1156229583278153729,"https://pbs.twimg.com/profile_images/1156229735007043590/cIq1N33j_normal.jpg",1097,47,40,"2019-07-30 11:46:29","Geo Bar & Pub - Un nuevo lugar en el centro de Montevideo donde se venden las mejores pizzas del mundo!!","Maldonado 1449 esq. Amorin","es","","","","","","","","","","","","","","","","","","","","",
519,"https://twitter.com/pilicanedo/statuses/1273039376314966017","https://twitter.com/pilicanedo/statuses/1273039376314966017","2020-06-16 19:46:53","pilicanedo","RT @MiguelFNogueira: En #Uruguay mueren 7 personas por día por Accidentes Cerebro Vasculares - ACV. Son casi 3.000 por año y en nuestro paí…","En #Uruguay mueren 7 personas por día por Accidentes Cerebro Vasculares - ACV. Son casi 3.000 por año y en nuestro país afecta más a las mujeres. @vtvnoticiasuy  @VTVuruguay","Twitter for Android",2250445659,"https://pbs.twimg.com/profile_images/611197104409714688/8ZFmhxtK_normal.jpg",176028,704,739,"2013-12-29 12:07:17","","","es","","","","","","","","","","","","","","","","","","","","",
520,"https://twitter.com/HugoPericop5/statuses/1273039248309071873","https://twitter.com/HugoPericop5/statuses/1273039248309071873","2020-06-16 19:46:23","HugoPericop5","RT @lisickilitvin: César Litvin: “para qué sirve en realidad la residencia fiscal en #Uruguay”  Opinión del Dr. ⁦@CRLitvin⁩, CEO de #Lisick…","César Litvin: “para qué sirve en realidad la residencia fiscal en #Uruguay”  Opinión del Dr. ⁦@CRLitvin⁩, CEO de #LisickiLitvin, vía #RoadShow  https://t.co/M8UmaSRVZO","Twitter for iPad",1213577676,"https://pbs.twimg.com/profile_images/1267501500827414530/OS9pPNdL_normal.jpg",26601,892,8534,"2013-02-23 15:17:13","Racing, Ferro, Independiente, Sporting de Gijon , Estudiantes de la Plata Seleccion: Olimpiadas de seul 88, Mundial EE.UU 1994, Copa America 1995, Copa Rey Fahd","","es","","","","","","","","","","","","","","","","","","","","",
521,"https://twitter.com/NoelcuadroUy/statuses/1273039097158938624","https://twitter.com/NoelcuadroUy/statuses/1273039097158938624","2020-06-16 19:45:47","NoelcuadroUy","RT @AntoGordillo: Pongamos de moda: el naranja zanahoria, la granja Urguaya y el consumo de frutas y verduras! 🇺🇾 🥕🍠🍎🥬🥦🌽🍊🍋🍆 #uruguay #produ…","Pongamos de moda: el naranja zanahoria, la granja Urguaya y el consumo de frutas y verduras! 🇺🇾 🥕🍠🍎🥬🥦🌽🍊🍋🍆 #uruguay #producionuruguaya #Agricultura #alimentos #comida #saludable https://t.co/KTgTR8J6W3","Twitter Web App",2188481790,"https://pbs.twimg.com/profile_images/1270159266536620033/Ug8q56UV_normal.jpg",16521,333,317,"2013-11-11 09:30:34","Maestro. Profesor de Literatura. Hincha de NACIONAL, desde el vientre de mi madre. Apostando a la renovación de la clase política uruguaya.","Uruguay","es","","","","","","","","","","","","","","","","","","","","",
522,"https://twitter.com/sara17almada/statuses/1273038366452387841","https://twitter.com/sara17almada/statuses/1273038366452387841","2020-06-16 19:42:53","sara17almada","RT @MiguelFNogueira: En #Uruguay mueren 7 personas por día por Accidentes Cerebro Vasculares - ACV. Son casi 3.000 por año y en nuestro paí…","En #Uruguay mueren 7 personas por día por Accidentes Cerebro Vasculares - ACV. Son casi 3.000 por año y en nuestro país afecta más a las mujeres. @vtvnoticiasuy  @VTVuruguay","Twitter for Android",4913817311,"https://pbs.twimg.com/profile_images/1263437020162121729/eyjUmpSz_normal.jpg",28046,1860,559,"2016-02-15 09:10:14","Todavia viviendo una 2da oportunidad !!!","Canelones, Uruguay","es","","","","","","","","","","","","","","","","","","","","",
523,"https://twitter.com/DonateUy/statuses/1273038332021411840","https://twitter.com/DonateUy/statuses/1273038332021411840","2020-06-16 19:42:44","DonateUy","¡Súmate a nuestra comunidad y convertite en un héroe!🙌🏻 - #donate #donacion #sangre #uruguay https://t.co/nSckJuRv2w","¡Súmate a nuestra comunidad y convertite en un héroe!🙌🏻 - #donate #donacion #sangre #uruguay https://t.co/nSckJuRv2w","Twitter for iPhone",1271870252306046976,"https://pbs.twimg.com/profile_images/1271870381515853824/8EFdqvNy_normal.jpg",8,50,14,"2020-06-13 14:21:22","App que facilita, incentiva y premia la donación de sangre","","es","","","","","","","","","","","","","","","","","","","","",
524,"https://twitter.com/Morales_Ingarth/statuses/1273038144770842630","https://twitter.com/Morales_Ingarth/statuses/1273038144770842630","2020-06-16 19:42:00","Morales_Ingarth","RT @Techo: Hoy hace 17 años un grupo de jóvenes iniciaron el trabajo de #TECHO en #Uruguay.  Gracias a todas esas familias que han marcado…","Hoy hace 17 años un grupo de jóvenes iniciaron el trabajo de #TECHO en #Uruguay.  Gracias a todas esas familias que han marcado historia, al voluntariado que esta hoy liderando, y al que estuvo y marcó el camino. 🥳¡Muchas felicidades al gran equipo de @TECHOuy!","Twitter for Android",298861117,"https://pbs.twimg.com/profile_images/480862655163285505/iUBKgiyg_normal.jpeg",32783,780,638,"2011-05-14 22:34:14","Nacimos para ser felices y aprender... 🌷🌷🌷","","es","","","","","","","","","","","","","","","","","","","","",
525,"https://twitter.com/GeobarUruguay/statuses/1273038119969992705","https://twitter.com/GeobarUruguay/statuses/1273038119969992705","2020-06-16 19:41:54","GeobarUruguay","Mejores precios en COMIDA y BEBIDA, mejor PIZZA y MUZZA del mundo, las MILANESAS+grandes, CHIVITOS locura, HAMBURGUESAS celestiales, la comida más rica, las bebidas+baratas, Proba, GEOBAR–Maldonado 1449 Pedidos al 092670338. #Montevideo #Uruguay  #CiudadVieja #Centro #Cordon https://t.co/mHCA7FeWP0","Mejores precios en COMIDA y BEBIDA, mejor PIZZA y MUZZA del mundo, las MILANESAS+grandes, CHIVITOS locura, HAMBURGUESAS celestiales, la comida más rica, las bebidas+baratas, Proba, GEOBAR–Maldonado 1449 Pedidos al 092670338. #Montevideo #Uruguay  #CiudadVieja #Centro #Cordon https://t.co/mHCA7FeWP0","Twitter Web App",1156229583278153729,"https://pbs.twimg.com/profile_images/1156229735007043590/cIq1N33j_normal.jpg",1097,47,40,"2019-07-30 11:46:29","Geo Bar & Pub - Un nuevo lugar en el centro de Montevideo donde se venden las mejores pizzas del mundo!!","Maldonado 1449 esq. Amorin","es","","","","","","","","","","","","","","","","","","","","",
526,"https://twitter.com/tamaracoromoto/statuses/1273037849911332869","https://twitter.com/tamaracoromoto/statuses/1273037849911332869","2020-06-16 19:40:49","tamaracoromoto","RT @tamaracoromoto: #Argentina #Brasil #Bolivia #CostaRica #Colombia #Cuba #Chile #Ecuador #EEUU #Canada #Guatemala #Guyana #Haiti #Hondura…","#Argentina #Brasil #Bolivia #CostaRica #Colombia #Cuba #Chile #Ecuador #EEUU #Canada #Guatemala #Guyana #Haiti #Honduras #Jamaica #Mexico #Nicaragua  #Panama #Paraguay #Peru #PuertoRico #RepublicaDominicana #Uruguay #Venezuela #16Jun #17Jun #PencoJablador #16Junio #hibernacion https://t.co/sNKxXXcrz4","Twitter for Android",92653651,"https://pbs.twimg.com/profile_images/1224351889749356545/Gxl49Q2I_normal.jpg",221761,1597,1386,"2009-11-25 20:07:00","ENTERRAD MI CUERPO CERCA DEL MAR EN VENEZUELA.  #IntervencionMilitarYa  Telegram: https://t.co/dHPsgKf3np…","En cualquier parte del planeta","und","","","","","","","","","","","","","","","","","","","","",
527,"https://twitter.com/GeobarUruguay/statuses/1273037795888685057","https://twitter.com/GeobarUruguay/statuses/1273037795888685057","2020-06-16 19:40:37","GeobarUruguay","Delivery al 092670338 o 29031032 o Whatsapp 096509466, Pizzas Milanesas Hamburguesas Chivitos Gramajos Sandwiche Caliente #uruguay #montevideo #pizza #bar #tragos #movida #joven #followme #travel #food #musica #delivery #drinks #cervezaartesanal #photooftheday #instafood #music https://t.co/ABaibSep3z","Delivery al 092670338 o 29031032 o Whatsapp 096509466, Pizzas Milanesas Hamburguesas Chivitos Gramajos Sandwiche Caliente #uruguay #montevideo #pizza #bar #tragos #movida #joven #followme #travel #food #musica #delivery #drinks #cervezaartesanal #photooftheday #instafood #music https://t.co/ABaibSep3z","Twitter Web App",1156229583278153729,"https://pbs.twimg.com/profile_images/1156229735007043590/cIq1N33j_normal.jpg",1097,47,40,"2019-07-30 11:46:29","Geo Bar & Pub - Un nuevo lugar en el centro de Montevideo donde se venden las mejores pizzas del mundo!!","Maldonado 1449 esq. Amorin","es","","","","","","","","","","","","","","","","","","","","",
528,"https://twitter.com/slc200/statuses/1273037212557479936","https://twitter.com/slc200/statuses/1273037212557479936","2020-06-16 19:38:18","slc200","RT @ecotalvora: Declaración Grupo d Contacto 16JUN20 sobre #Venezuela: ""renovación d #CNE por el #TSJ socava la credibilidad del próximo pr…","Declaración Grupo d Contacto 16JUN20 sobre #Venezuela: ""renovación d #CNE por el #TSJ socava la credibilidad del próximo proceso electoral"": firman #Francia #Alemania #Italia #PaísesBajos #Portugal #España #Suecia, #ReinoUnido #Ecuador #CostaRica #Panamá y #Uruguay https://t.co/uandf8iTR5","Twitter for Android",50345759,"https://pbs.twimg.com/profile_images/909382922960080897/roKbjU6P_normal.jpg",127465,1214,939,"2009-06-24 12:03:47","abogado","caracas, venezuela","es","","","","","","","","","","","","","","","","","","","","",
529,"https://twitter.com/Super10puestas/statuses/1273037212507127814","https://twitter.com/Super10puestas/statuses/1273037212507127814","2020-06-16 19:38:18","Super10puestas","↪ Quieres tener los #consejoapuestas en tu 👉📱  Enviar #consejossegurosgratis  A:  https://t.co/ErLTduOLJY  Apuesta con responsabilidad +18  #sportsbets #lasvegas #australia #Argentina #Mexico #sportskoklađenje #uruguay #brasil #chile #venezuela #MLS #NBA #NHL #NFL #WNBA https://t.co/aXKTSXiYy0","↪ Quieres tener los #consejoapuestas en tu 👉📱  Enviar #consejossegurosgratis  A:  https://t.co/ErLTduOLJY  Apuesta con responsabilidad +18  #sportsbets #lasvegas #australia #Argentina #Mexico #sportskoklađenje #uruguay #brasil #chile #venezuela #MLS #NBA #NHL #NFL #WNBA https://t.co/aXKTSXiYy0","Twitter Web App",705771165927784448,"https://pbs.twimg.com/profile_images/986374974779904005/WZSgCHl3_normal.jpg",871,10,41,"2016-03-04 10:05:33","Consejos en apuestas deportivas Sports betting tips⚽🎾🏀⚾🏉🎿","Spain","es","","","","","","","","","","","","","","","","","","","","",
530,"https://twitter.com/23ALZAT/statuses/1273036994680180738","https://twitter.com/23ALZAT/statuses/1273036994680180738","2020-06-16 19:37:26","23ALZAT","RT @CoronavirusNewv: 🇺🇾 | URUGUAY   #ULTIMAHORA Uruguay ha registrado 849 casos positivos confirmados de Coronavirus COVID-19 en todo el te…","🇺🇾 | URUGUAY   #ULTIMAHORA Uruguay ha registrado 849 casos positivos confirmados de Coronavirus COVID-19 en todo el territorio nacional. De ese total, 801 ya se recuperaron y 24 fallecieron. @sinae_oficial #Uruguay #Covid_19 #coronavirus https://t.co/g8hwvAa7Nv","Twitter Web App",2213062418,"https://pbs.twimg.com/profile_images/444549251444383744/4u6pEtU-_normal.jpeg",544629,3437,3725,"2013-11-24 15:48:34","Gestora Cultural- Vigías los Robledales- Corporación Ambiental Bosques de Arví","Medellín","es","","","","","","","","","","","","","","","","","","","","",
531,"https://twitter.com/Techo/statuses/1273036827780419586","https://twitter.com/Techo/statuses/1273036827780419586","2020-06-16 19:36:46","Techo","Hoy hace 17 años un grupo de jóvenes iniciaron el trabajo de #TECHO en #Uruguay.  Gracias a todas esas familias que han marcado historia, al voluntariado que esta hoy liderando, y al que estuvo y marcó el camino. 🥳¡Muchas felicidades al gran equipo de @TECHOuy!","Hoy hace 17 años un grupo de jóvenes iniciaron el trabajo de #TECHO en #Uruguay.  Gracias a todas esas familias que han marcado historia, al voluntariado que esta hoy liderando, y al que estuvo y marcó el camino. 🥳¡Muchas felicidades al gran equipo de @TECHOuy!","Twitter Web App",38868753,"https://pbs.twimg.com/profile_images/811572223681110016/Ll9Notfq_normal.jpg",17760,2332,287082,"2009-05-09 11:17:20","Twitter oficial de #TECHO: Habitantes de #asentamientos y jóvenes voluntarios/as trabajando juntos por un mundo más justo y sin pobreza.","América Latina y El Caribe","es","","","","","","","","","","","","","","","","","","","","",
532,"https://twitter.com/oscarhaboni/statuses/1273036821736366080","https://twitter.com/oscarhaboni/statuses/1273036821736366080","2020-06-16 19:36:44","oscarhaboni","RT @CoronavirusNewv: 🇺🇾 | URUGUAY   #ULTIMAHORA Uruguay ha registrado 849 casos positivos confirmados de Coronavirus COVID-19 en todo el te…","🇺🇾 | URUGUAY   #ULTIMAHORA Uruguay ha registrado 849 casos positivos confirmados de Coronavirus COVID-19 en todo el territorio nacional. De ese total, 801 ya se recuperaron y 24 fallecieron. @sinae_oficial #Uruguay #Covid_19 #coronavirus https://t.co/g8hwvAa7Nv","Twitter for iPhone",2957729835,"https://pbs.twimg.com/profile_images/1263324667525332993/m1HbrLax_normal.jpg",844051,860,3764,"2015-01-02 21:34:56","MUCHOS HAN HECHO CAPITALES DE CORRUPCIÓN, ACEPTEN.. QUIZÁ SEA UN DON FAMILIAR. (Zirconio)","","es","","","","","","","","","","","","","","","","","","","","",
533,"https://twitter.com/hectorluis1975/statuses/1273036811846258688","https://twitter.com/hectorluis1975/statuses/1273036811846258688","2020-06-16 19:36:42","hectorluis1975","RT @teleSURtv: Santana do Livramento en #Brasil🇧🇷 y Riviera en #Uruguay🇺🇾: Las ciudades fronterizas que tensionan la reactivación económica…","Santana do Livramento en #Brasil🇧🇷 y Riviera en #Uruguay🇺🇾: Las ciudades fronterizas que tensionan la reactivación económica charrúa en medio de la pandemia por #Covid_19 https://t.co/MiitdkYueb  Modelos de contención del virus ponen en peligro el flujo entre ambas naciones https://t.co/4RFtFlavLI","Twitter for Android",352372868,"https://pbs.twimg.com/profile_images/1246415620624842754/TjP8m2Z9_normal.jpg",203008,223,949,"2011-08-10 10:43:22","Abogado, Lic. en Administración, Oficial de Policía. en la actualidad Consultor Jurídico del Instituto Autónomo Minas Bolívar","venezuela","es","","","","","","","","","","","","","","","","","","","","",
534,"https://twitter.com/Rod_manza/statuses/1273036607214534658","https://twitter.com/Rod_manza/statuses/1273036607214534658","2020-06-16 19:35:53","Rod_manza","RT @RodrigoNcruz: A 34 años del partidazo frente a #Uruguay en #Mexico86  Las piernas hablan... https://t.co/22p6ORMFr1","A 34 años del partidazo frente a #Uruguay en #Mexico86  Las piernas hablan... https://t.co/22p6ORMFr1","Twitter for iPhone",345573845,"https://pbs.twimg.com/profile_images/1109980989898530816/w7gNnYy6_normal.jpg",47229,2255,803,"2011-07-30 16:35:26","Maradoniano, como toda persona de bien. Fanático de #Independiente .:: Para mi adiccion giles son lo que sobra ::.","","es","","","","","","","","","","","","","","","","","","","","",
535,"https://twitter.com/maiaavellana/statuses/1273036328670597120","https://twitter.com/maiaavellana/statuses/1273036328670597120","2020-06-16 19:34:47","maiaavellana","RT @MiguelFNogueira: En #Uruguay mueren 7 personas por día por Accidentes Cerebro Vasculares - ACV. Son casi 3.000 por año y en nuestro paí…","En #Uruguay mueren 7 personas por día por Accidentes Cerebro Vasculares - ACV. Son casi 3.000 por año y en nuestro país afecta más a las mujeres. @vtvnoticiasuy  @VTVuruguay","Twitter for Android",4505050107,"https://pbs.twimg.com/profile_images/771411220238888960/zg-dzlmc_normal.jpg",157080,1239,1463,"2015-12-16 12:27:30","","","es","","","","","","","","","","","","","","","","","","","","",
536,"https://twitter.com/eldelalibreta/statuses/1273035901153746945","https://twitter.com/eldelalibreta/statuses/1273035901153746945","2020-06-16 19:33:05","eldelalibreta","Mas de 5 mil niñas jugando al fútbol en #Uruguay . Avanzamos como diría la gran @medeapoma ! https://t.co/VfcnsyJpPQ","Mas de 5 mil niñas jugando al fútbol en #Uruguay . Avanzamos como diría la gran @medeapoma ! https://t.co/VfcnsyJpPQ","Twitter for iPhone",1006519268014542849,"https://pbs.twimg.com/profile_images/1143184716289531905/92tfvD18_normal.jpg",1048,140,159,"2018-06-12 08:51:08","","","es","","","","","","","","","","","","","","","","","","","","",
537,"https://twitter.com/Verovaldes7/statuses/1273035755410067461","https://twitter.com/Verovaldes7/statuses/1273035755410067461","2020-06-16 19:32:30","Verovaldes7","RT @DanielRemedi: El periodismo macrista te ponía de ejemplo #Chile , se pudrió todo con el #Covid_19 y las manifestaciones populares contr…","El periodismo macrista te ponía de ejemplo #Chile , se pudrió todo con el #Covid_19 y las manifestaciones populares contra la desigualdad y ahora es #Uruguay ,(no es comparable en nada)  que sería como un pueblo de Argentina. Asi son, unos chantas! #TodoConduceAMacri","Twitter for Android",1156284681672900608,"https://pbs.twimg.com/profile_images/1243595238922387460/366s6_gx_normal.jpg",18040,1753,1399,"2019-07-30 15:25:25","Estoy advertida,siempre hay un resto. Psicoanalisis y peronismo, a consecuencia de ser incorregible!!❤✌","CABA","es","","","","","","","","","","","","","","","","","","","","",
538,"https://twitter.com/CidPaolaCecilia/statuses/1273035747646464001","https://twitter.com/CidPaolaCecilia/statuses/1273035747646464001","2020-06-16 19:32:28","CidPaolaCecilia","RT @NzTrustee: #Uruguay - coming back to the “Switzerland of South America” (?) #Banking #Legal","#Uruguay - coming back to the “Switzerland of South America” (?) #Banking #Legal https://t.co/MlRZQRz6t1","Twitter for Android",990693870550822913,"https://pbs.twimg.com/profile_images/1204591242736214016/OkmfCld6_normal.jpg",5312,1283,405,"2018-04-29 16:46:39","Estudiante de Lic. RR. II.  Concientizar sobre la importancia de la crianza compartida! Pro Familia, Pro Igualdad Real, Pro Vida, definitivamente Anti k!","Río Negro, Argentina","en","","","","","","","","","","","","","","","","","","","","",
539,"https://twitter.com/DiiegoDelgado7/statuses/1273035280325447683","https://twitter.com/DiiegoDelgado7/statuses/1273035280325447683","2020-06-16 19:30:37","DiiegoDelgado7","RT @RafaaCastillo14: #AHORA Hay 849 (+1) casos positivos confirmados de #Covid_19 en #Uruguay   Hay 24 activos, 3 en CTI. 801 (+10) se recu…","#AHORA Hay 849 (+1) casos positivos confirmados de #Covid_19 en #Uruguay   Hay 24 activos, 3 en CTI. 801 (+10) se recuperaron y 24 fallecieron (se incluyó al filipino tripulante del Greg Mortimer).  Del total 110 son personal de la salud. 106 recuperados, 3 activos y 1 fallecido.","Twitter for Android",1366048872,"https://pbs.twimg.com/profile_images/1245121912138805254/wC4THotY_normal.jpg",19758,1996,307,"2013-04-19 23:36:23","💙💞💜 ... 21-01-2018  Geminis ♊","Lascano Rocha Uruguay","es","","","","","","","","","","","","","","","","","","","","",
