id,guid,link,pubdate,author,title,description,source,user_id,profile_image_url,user_statuses_count,user_friends_count,user_followers_count,user_created_at,user_bio,user_location,lang,coords,
254,"https://twitter.com/vermudeportivo/statuses/1273090913087225858","https://twitter.com/vermudeportivo/statuses/1273090913087225858","2020-06-16 23:11:41","vermudeportivo","#Italia90 - #Uruguay 🇺🇾 1 vs #Bélgica 🇧🇪 3 - Ni la Roja sacó a la Celeste de su mente en Blanco  Hace 30 años, los charrúas jugaron un partido para el olvido a pesar del hombre de más en toda la complementaria. Así lo recuerda @marcepatroncini https://t.co/YwQrUCoWWK 📸 Getty https://t.co/dkZEhGRQGQ","#Italia90 - #Uruguay 🇺🇾 1 vs #Bélgica 🇧🇪 3 - Ni la Roja sacó a la Celeste de su mente en Blanco  Hace 30 años, los charrúas jugaron un partido para el olvido a pesar del hombre de más en toda la complementaria. Así lo recuerda @marcepatroncini https://t.co/YwQrUCoWWK 📸 Getty https://t.co/dkZEhGRQGQ","Twitter for iPhone",306562910,"https://pbs.twimg.com/profile_images/557572088525897728/-qrFBGPe_normal.jpeg",128322,1832,14412,"2011-05-27 23:01:31","Somos un medio de Primera, en ascenso. Un medio nacional con roce internacional. Somos una forma distinta de hacer periodismo. Somos Vermouth Deportivo","Argentina","es","","","","","","","","","","","","","","","","","","","","",
255,"https://twitter.com/rodrigobarrerai/statuses/1273090896318410754","https://twitter.com/rodrigobarrerai/statuses/1273090896318410754","2020-06-16 23:11:37","rodrigobarrerai","RT @Agencia__SE: Este jueves 18 se realizará hito de inicio del Proyecto de Cooperación #Chile-#Uruguay: #ComunaEnergética y #AcciónClimáti…","Este jueves 18 se realizará hito de inicio del Proyecto de Cooperación #Chile-#Uruguay: #ComunaEnergética y #AcciónClimáticaLocal ⚡ https://t.co/adzXI9Cofi https://t.co/BzTuwMsLSn","Twitter for iPhone",107887029,"https://pbs.twimg.com/profile_images/1207070238736605185/ozLAmxjM_normal.jpg",612,2339,486,"2010-01-23 22:03:32","#ComunaEnergética en @agenciadese Ciudades sostenibles y resilientes al CC","","es","","","","","","","","","","","","","","","","","","","","",
256,"https://twitter.com/AteoSalvo/statuses/1273090880711397377","https://twitter.com/AteoSalvo/statuses/1273090880711397377","2020-06-16 23:11:33","AteoSalvo","RT @cannabishispano: Diseñan audífonos de gama alta con materia prima de #cáñamo -&gt;https://t.co/M2h7NdWgt8 . #cannabismedicinal #marihuana…","Diseñan audífonos de gama alta con materia prima de #cáñamo -&gt;https://t.co/M2h7NdWgt8 . #cannabismedicinal #marihuana #Cannabis #Mexico #Peru #Colombia #Chile #Uruguay #CostaRica #ElSalvador #Brasil #Argentina #Bolivia #Paraguay #Ecuador https://t.co/HYfIF1ff3G","rtgv",846527169912279040,"https://pbs.twimg.com/profile_images/1248063851272245248/9oWAf05y_normal.jpg",28715,161,347,"2017-03-27 20:59:39","pasando por una metamorfosis profunda en tiempos apocalípticos #SomosLegion","El Salvador","es","","","","","","","","","","","","","","","","","","","","",
257,"https://twitter.com/teleSURtv/statuses/1273090741120589826","https://twitter.com/teleSURtv/statuses/1273090741120589826","2020-06-16 23:11:00","teleSURtv","Avanza segunda etapa del reinicio de las clases presenciales en #Uruguay🇺🇾 en el marco del decreto de la ""nueva normalidad 👉🏿https://t.co/LT5Nc9keN5  Este lunes 15 de junio reabrieron en el país suramericano 156 escuelas técnicas, 200 liceos y más de 1.000 escuelas públicas👩🏿‍🏫 https://t.co/NvePHmbRd2","Avanza segunda etapa del reinicio de las clases presenciales en #Uruguay🇺🇾 en el marco del decreto de la ""nueva normalidad 👉🏿https://t.co/LT5Nc9keN5  Este lunes 15 de junio reabrieron en el país suramericano 156 escuelas técnicas, 200 liceos y más de 1.000 escuelas públicas👩🏿‍🏫 https://t.co/NvePHmbRd2","TweetDeck",45013575,"https://pbs.twimg.com/profile_images/1214234559291641858/jvbPOTcs_normal.jpg",1257007,285,1913318,"2009-06-05 18:21:49","Con más de 40 corresponsales en el mundo, alzamos nuestra voz donde otros medios callan. teleSUR es la señal informativa de América Latina","Caracas","es","","","","","","","","","","","","","","","","","","","","",
258,"https://twitter.com/cannabishispano/statuses/1273090506680143872","https://twitter.com/cannabishispano/statuses/1273090506680143872","2020-06-16 23:10:04","cannabishispano","Diseñan audífonos de gama alta con materia prima de #cáñamo -&gt;https://t.co/M2h7NdWgt8 . #cannabismedicinal #marihuana #Cannabis #Mexico #Peru #Colombia #Chile #Uruguay #CostaRica #ElSalvador #Brasil #Argentina #Bolivia #Paraguay #Ecuador https://t.co/HYfIF1ff3G","Diseñan audífonos de gama alta con materia prima de #cáñamo -&gt;https://t.co/M2h7NdWgt8 . #cannabismedicinal #marihuana #Cannabis #Mexico #Peru #Colombia #Chile #Uruguay #CostaRica #ElSalvador #Brasil #Argentina #Bolivia #Paraguay #Ecuador https://t.co/HYfIF1ff3G","Hootsuite Inc.",456164587,"https://pbs.twimg.com/profile_images/1246982343879004161/E2SR9uF7_normal.jpg",2205,784,368,"2012-01-05 18:17:45","🔊🎙🎙Información en español relacionada con la industria del #Cannabis #Marihuana #CBD. *Contenido para mayores de 21 años. 🇨🇦 +21","Canada","es","","","","","","","","","","","","","","","","","","","","",
259,"https://twitter.com/GaboVzla/statuses/1273090432713531392","https://twitter.com/GaboVzla/statuses/1273090432713531392","2020-06-16 23:09:46","GaboVzla","#Uruguay #Venezuela https://t.co/rmA7dj0MKD","#Uruguay #Venezuela https://t.co/rmA7dj0MKD","Twitter for iPhone",65398654,"https://pbs.twimg.com/profile_images/1200199411286056966/zXnWFin9_normal.jpg",138034,2419,35168,"2009-08-13 12:13:41","Periodista. Fanático #RedSox y #Magallanes. Mi TL refleja mi opinión, no la de los medios donde trabajo. Esta tierra es buena. RT\'s not endorsements.","Caracas, Venezuela","und","","","","","","","","","","","","","","","","","","","","",
260,"https://twitter.com/Superalitita/statuses/1273090116244828160","https://twitter.com/Superalitita/statuses/1273090116244828160","2020-06-16 23:08:31","Superalitita","RT @SasovskyAsoc: #Uruguay 🇺🇾 acceda al proyecto que duplica vacaciones impositivas https://t.co/1ftXbhnzeA  La opinion de IVAN SASOVSKY  @…","#Uruguay 🇺🇾 acceda al proyecto que duplica vacaciones impositivas https://t.co/1ftXbhnzeA  La opinion de IVAN SASOVSKY  @ivansasovsky para @iProfesional","Twitter for iPhone",758266808,"https://pbs.twimg.com/profile_images/1209924845808607232/PGaLlDKh_normal.jpg",1387086,2105,7140,"2012-08-14 21:23:57","Esta cta apoya a todas las victimas del terrorismo y los injustamente presos políticos x falsa lesa. Anti K y anti terroristas montoneros, Erp, etc.","","es","","","","","","","","","","","","","","","","","","","","",
261,"https://twitter.com/NancyTo39508845/statuses/1273089994207494145","https://twitter.com/NancyTo39508845/statuses/1273089994207494145","2020-06-16 23:08:02","NancyTo39508845","RT @fwernerv: Lapidario informe de relatores de @ONU_es contra la Ley de Urgente Consideración #LUC. Si se aprueban artículos sobre protest…","Lapidario informe de relatores de @ONU_es contra la Ley de Urgente Consideración #LUC. Si se aprueban artículos sobre protesta pacífica y uso de fuerza policial, #Uruguay pasará a incumplir el Pacto Internacional de Derechos Civiles y Políticos @davidakaye @cvoule @AgnesCallamard https://t.co/1vGJJdilF1","Twitter Web App",1124918150376644608,"https://pbs.twimg.com/profile_images/1124918395638616064/6to-mT5h_normal.jpg",36,67,8,"2019-05-05 02:06:01","","","es","","","","","","","","","","","","","","","","","","","","",
262,"https://twitter.com/marcepatroncini/statuses/1273089829153255426","https://twitter.com/marcepatroncini/statuses/1273089829153255426","2020-06-16 23:07:22","marcepatroncini","Hace 30 años, #Bélgica 🇧🇪 derrotaba por 3 a 1 a #Uruguay 🇺🇾 en #Italia90. El primer gol lo hizo el padre de la tenista, Kim Clijsters. El tanto charrúa fue de Bengoechea tras un córner con rosca de Rubén Paz. Así lo cuento en @vermudeportivo https://t.co/PwvH9vCGbf 🎥 FIFA https://t.co/9Zicx1KgBe","Hace 30 años, #Bélgica 🇧🇪 derrotaba por 3 a 1 a #Uruguay 🇺🇾 en #Italia90. El primer gol lo hizo el padre de la tenista, Kim Clijsters. El tanto charrúa fue de Bengoechea tras un córner con rosca de Rubén Paz. Así lo cuento en @vermudeportivo https://t.co/PwvH9vCGbf 🎥 FIFA https://t.co/9Zicx1KgBe","Twitter for iPhone",240841289,"https://pbs.twimg.com/profile_images/748233213663838208/VWr25hmS_normal.jpg",10886,688,1679,"2011-01-20 16:38:02","Periodista, escritor, amante del fútbol, el turismo y el buen whisky. Imposible no imaginarme al banquete celestial sin una milanesa napolitana y un buen vino.","Buenos Aires, Argentina","es","","","","","","","","","","","","","","","","","","","","",
263,"https://twitter.com/AngelaMaria_033/statuses/1273089682168057856","https://twitter.com/AngelaMaria_033/statuses/1273089682168057856","2020-06-16 23:06:47","AngelaMaria_033","RT @HerodiasPor2: Según datos relevados por #Unicef 152 menores fueron asesinados en 7 años en #Uruguay:  - 7 de cada 10 de esos homicidios…","Según datos relevados por #Unicef 152 menores fueron asesinados en 7 años en #Uruguay:  - 7 de cada 10 de esos homicidios tuvo por víctima a un varón - El 24 % del total de las víctimas tenía entre 0 y 5 años  - El 66 % de ellas adolescentes https://t.co/Ll7XA8KV3m","Twitter for Android",1692457825,"https://pbs.twimg.com/profile_images/899659488554348545/Ztlg-mPc_normal.jpg",37334,1646,1508,"2013-08-22 20:22:12","Cuando eres observador todo el mundo es tu maestro.","🇺🇾","es","","","","","","","","","","","","","","","","","","","","",
264,"https://twitter.com/El_Loco_Vinagre/statuses/1273089183196856320","https://twitter.com/El_Loco_Vinagre/statuses/1273089183196856320","2020-06-16 23:04:48","El_Loco_Vinagre","RT @HerodiasPor2: Según datos relevados por #Unicef 152 menores fueron asesinados en 7 años en #Uruguay:  - 7 de cada 10 de esos homicidios…","Según datos relevados por #Unicef 152 menores fueron asesinados en 7 años en #Uruguay:  - 7 de cada 10 de esos homicidios tuvo por víctima a un varón - El 24 % del total de las víctimas tenía entre 0 y 5 años  - El 66 % de ellas adolescentes https://t.co/Ll7XA8KV3m","Twitter for iPhone",2423003238,"https://pbs.twimg.com/profile_images/1253187600954863616/zcSNBlw7_normal.jpg",85292,293,2299,"2014-04-01 21:46:52","La voz del Loco Vinagre. Pieza fundamental del 2o. Quinquenio de Oro del Club Atlético Peñarol. Mascota del Contador. Padre de muchas gallinas.","Montevideo, Uruguay","es","","","","","","","","","","","","","","","","","","","","",
265,"https://twitter.com/pablo_urbiina/statuses/1273089089340923904","https://twitter.com/pablo_urbiina/statuses/1273089089340923904","2020-06-16 23:04:26","pablo_urbiina","RT @SenasaAR: El pasado viernes reabrió la terminal de @buquebus_ar y retomamos los controles sanitarios en los buques que arriban al país…","El pasado viernes reabrió la terminal de @buquebus_ar y retomamos los controles sanitarios en los buques que arriban al país con pasajeros repatriados de #Uruguay 🇺🇾 Durante todo el mes de junio, la terminal recibirá los barcos los días viernes. #ArgentinaUnida https://t.co/jNW6ZDGKI5","Twitter for Android",1009825003834142726,"https://pbs.twimg.com/profile_images/1250160865896280070/827QvZhB_normal.jpg",365,78,47,"2018-06-21 11:46:57","inspector en #patrullamoviles. @senasa INFANTE (EE.AA)","Argentina, plaza huincul","es","","","","","","","","","","","","","","","","","","","","",
266,"https://twitter.com/BadillaVicho/statuses/1273088567305273344","https://twitter.com/BadillaVicho/statuses/1273088567305273344","2020-06-16 23:02:21","BadillaVicho","#Mexico #Guatemala #Honduras #ElSalvador #Nicaragua #CostaRica #Panama #Colombia #Venezuela #Ecuador #Peru #Brasil #Bolivia  #Argentina #Uruguay #Paraguay #Haiti #PuertoRico #RepublicaDominicana https://t.co/rxz8atsBkq","#Mexico #Guatemala #Honduras #ElSalvador #Nicaragua #CostaRica #Panama #Colombia #Venezuela #Ecuador #Peru #Brasil #Bolivia  #Argentina #Uruguay #Paraguay #Haiti #PuertoRico #RepublicaDominicana https://t.co/rxz8atsBkq","Twitter for Android",1198318443558297602,"https://pbs.twimg.com/profile_images/1269114522863796230/mf_LgwOj_normal.jpg",12435,381,197,"2019-11-23 14:12:49","Para difundir hasta que me tumben la cuenta","","und","","","","","","","","","","","","","","","","","","","","",
267,"https://twitter.com/Artigasgs/statuses/1273087346775384066","https://twitter.com/Artigasgs/statuses/1273087346775384066","2020-06-16 22:57:30","Artigasgs","RT @MiguelFNogueira: En #Uruguay mueren 7 personas por día por Accidentes Cerebro Vasculares - ACV. Son casi 3.000 por año y en nuestro paí…","En #Uruguay mueren 7 personas por día por Accidentes Cerebro Vasculares - ACV. Son casi 3.000 por año y en nuestro país afecta más a las mujeres. @vtvnoticiasuy  @VTVuruguay","Twitter for Android",440543663,"https://pbs.twimg.com/profile_images/1262745022132219909/sa6gi4yk_normal.jpg",93410,2406,1202,"2011-12-18 22:56:40","abogado -colorado-bolso d corazon #nosvimosyganamos","","es","","","","","","","","","","","","","","","","","","","","",
268,"https://twitter.com/aiqu_uruguay/statuses/1273087235634671617","https://twitter.com/aiqu_uruguay/statuses/1273087235634671617","2020-06-16 22:57:04","aiqu_uruguay","RT @Albaladm: Volvemos fuerte con #lanzamientocircular2020 impulsando la #economiacircular en #Uruguay, combinando el programa de #oportuni…","Volvemos fuerte con #lanzamientocircular2020 impulsando la #economiacircular en #Uruguay, combinando el programa de #oportunidadescirculares y el premio #uruguaycircular. Seguimos siendo referentes en la región impulsando la nueva economía https://t.co/2AmopPq2T7","Twitter Web App",2866222379,"https://pbs.twimg.com/profile_images/892184750462562304/T0mXQ28Y_normal.jpg",2664,247,246,"2014-11-07 14:57:00","Colectividad profesional natural de los Ingenieros Químicos del Uruguay fundada en 1933.","Gaboto 1083 - Montevideo","es","","","","","","","","","","","","","","","","","","","","",
269,"https://twitter.com/CapitanTocawebs/statuses/1273087203615309829","https://twitter.com/CapitanTocawebs/statuses/1273087203615309829","2020-06-16 22:56:56","CapitanTocawebs","RT @PerezMarina2006: Medico ⚕️ venezolana 🇻🇪 residenciada en #Uruguay 🇺🇾 dessde hace tres años, egresada de la Universidad de Carabobo deci…","Medico ⚕️ venezolana 🇻🇪 residenciada en #Uruguay 🇺🇾 dessde hace tres años, egresada de la Universidad de Carabobo decidió subirse al crucero ‘Greg Mortimer...🛳️ desafiando el Covid-19  a bordo..  https://t.co/zTzWdpsAPK","Twitter for Android",831703660774248449,"https://pbs.twimg.com/profile_images/1239428801903374340/UNqGxQW5_normal.jpg",105355,1356,2168,"2017-02-14 22:16:19","Piloto de la Marina Mercante, Capitán de Yate, animalista, antitaurino, cocinillas, majadero, republicano, camorrista y antipático. #YoApoyoAlGobierno","Varado en una puta playa. ","es","","","","","","","","","","","","","","","","","","","","",
270,"https://twitter.com/marchelagodoy/statuses/1273086955182587904","https://twitter.com/marchelagodoy/statuses/1273086955182587904","2020-06-16 22:55:57","marchelagodoy","RT @RED92cadadiamas: 🦠📲‼️ | #Coronavirus | #Pandemia | #Aplicaciones | #Uruguay lanzó una app de alerta de exposición al #COVID19  https://…","🦠📲‼️ | #Coronavirus | #Pandemia | #Aplicaciones | #Uruguay lanzó una app de alerta de exposición al #COVID19  https://t.co/ntszQq3CpD https://t.co/HMtLI1Ja9K","Twitter Web App",334812599,"https://pbs.twimg.com/profile_images/549212135432003584/DVw8KCgL_normal.jpeg",13422,611,301,"2011-07-13 14:17:14","Pido justicia por muchas cosas","La Plata, Argentina","es","","","","","","","","","","","","","","","","","","","","",
271,"https://twitter.com/GabooItu16/statuses/1273086629096325120","https://twitter.com/GabooItu16/statuses/1273086629096325120","2020-06-16 22:54:39","GabooItu16","RT @DataRef_: 16/06/1986  #Argentina 🇦🇷 venció 1-0 a #Uruguay 🇺🇾 en los octavos de final del Mundial 1986.  Pedro Pasculli aprovechó un reb…","16/06/1986  #Argentina 🇦🇷 venció 1-0 a #Uruguay 🇺🇾 en los octavos de final del Mundial 1986.  Pedro Pasculli aprovechó un rebote dentro del área y, con un remate cruzado, le dio el pase a cuartos al conjunto nacional ⚽  https://t.co/OBQkXzCM18","Twitter Web App",1312243555,"https://pbs.twimg.com/profile_images/1253182722551484417/T2VoqzpF_normal.jpg",1679,92,91,"2013-03-28 21:24:22","Amor eterno a JF10 #River","Argentina","es","","","","","","","","","","","","","","","","","","","","",
272,"https://twitter.com/Mariawlady/statuses/1273086422350733314","https://twitter.com/Mariawlady/statuses/1273086422350733314","2020-06-16 22:53:50","Mariawlady","RT @HerodiasPor2: Según datos relevados por #Unicef 152 menores fueron asesinados en 7 años en #Uruguay:  - 7 de cada 10 de esos homicidios…","Según datos relevados por #Unicef 152 menores fueron asesinados en 7 años en #Uruguay:  - 7 de cada 10 de esos homicidios tuvo por víctima a un varón - El 24 % del total de las víctimas tenía entre 0 y 5 años  - El 66 % de ellas adolescentes https://t.co/Ll7XA8KV3m","Twitter for iPhone",833337223,"https://abs.twimg.com/sticky/default_profile_images/default_profile_normal.png",100212,512,398,"2012-09-19 09:30:04","","","es","","","","","","","","","","","","","","","","","","","","",
273,"https://twitter.com/fgallottasantin/statuses/1273086230444552192","https://twitter.com/fgallottasantin/statuses/1273086230444552192","2020-06-16 22:53:04","fgallottasantin","⁦⁦⁦⁦@bbcmundo⁩ #Uruguay #COVID__19  https://t.co/LWvaUA5C1S","⁦⁦⁦⁦@bbcmundo⁩ #Uruguay #COVID__19  https://t.co/LWvaUA5C1S","Twitter for iPhone",3892693007,"https://pbs.twimg.com/profile_images/1081594387149275142/eUAZMMpR_normal.jpg",1028,854,450,"2015-10-07 15:24:22","Postgraduada en Dirección de #Marketing. Docente @Univmontevideo. Consultora","Uruguay","und","","","","","","","","","","","","","","","","","","","","",
274,"https://twitter.com/estefasellanes/statuses/1273085782476152832","https://twitter.com/estefasellanes/statuses/1273085782476152832","2020-06-16 22:51:17","estefasellanes","RT @SexosinSecretos: Difundimos 👇  #formacion #FormacionProfesional #oportunidad #uruguay #psicologos #sexologos #educadores https://t.co/M…","Difundimos 👇  #formacion #FormacionProfesional #oportunidad #uruguay #psicologos #sexologos #educadores https://t.co/MOAioOuY7H","Twitter for Android",779359074,"https://pbs.twimg.com/profile_images/1262097499743027200/nKZmV3ZQ_normal.jpg",1955,621,351,"2012-08-24 22:15:36","Estudiante de Comunicación / Educadora Sexual / Sex Coach","Uruguay","es","","","","","","","","","","","","","","","","","","","","",
275,"https://twitter.com/SexosinSecretos/statuses/1273085653438418945","https://twitter.com/SexosinSecretos/statuses/1273085653438418945","2020-06-16 22:50:47","SexosinSecretos","Difundimos 👇  #formacion #FormacionProfesional #oportunidad #uruguay #psicologos #sexologos #educadores https://t.co/MOAioOuY7H","Difundimos 👇  #formacion #FormacionProfesional #oportunidad #uruguay #psicologos #sexologos #educadores https://t.co/MOAioOuY7H","Twitter for Android",1254097365075734528,"https://pbs.twimg.com/profile_images/1268290391452930048/oDYrXagw_normal.jpg",206,48,89,"2020-04-25 13:18:19","Blog de educación sexual con recursos para trabajar en el aula. Brindamos asesoría, orientación y talleres para niños, jóvenes y adultos uruguayos.","Uruguay","es","","","","","","","","","","","","","","","","","","","","",
276,"https://twitter.com/cyrus_kuba/statuses/1273085036150034433","https://twitter.com/cyrus_kuba/statuses/1273085036150034433","2020-06-16 22:48:20","cyrus_kuba","RT @Dicotomia7: @ernesto_talvi Excelente Noticia Canciller @ernesto_talvi la Sociedad Civil Cubana Apoya el Regreso a #Uruguay de Lidier He…","@ernesto_talvi Excelente Noticia Canciller @ernesto_talvi la Sociedad Civil Cubana Apoya el Regreso a #Uruguay de Lidier Hernández @cyrus_kuba Junto a su Familia.","Twitter for iPhone",139794131,"https://pbs.twimg.com/profile_images/570599813045956608/7gVmlnvO_normal.jpeg",10319,758,1361,"2010-05-03 14:11:04","Cubano 100%. Prohibido de salir de Cuba en contra de mi voluntad. 🇨🇺🤵❌ 🛫🇺🇾🙎🏽‍♀️ #MiEsposaMeEspera #NoMásConsecuencias #NoMásTorturaPsicológica","Montevideo, Uruguay","es","","","","","","","","","","","","","","","","","","","","",
277,"https://twitter.com/marcelo_campi_/statuses/1273085004176928769","https://twitter.com/marcelo_campi_/statuses/1273085004176928769","2020-06-16 22:48:12","marcelo_campi_","#explore #simbolos #aerial #mysteryranch #fields #campos #nature #tree #dronestagram #history #uruguay #florida @djiglobal 🇺🇾 https://t.co/oWlVu8G8si","#explore #simbolos #aerial #mysteryranch #fields #campos #nature #tree #dronestagram #history #uruguay #florida @djiglobal 🇺🇾 https://t.co/oWlVu8G8si","Twitter for iPhone",554931555,"https://pbs.twimg.com/profile_images/901603491495514112/WRLWbynm_normal.jpg",1354,33,84,"2012-04-16 00:04:45","Drone hobbyist , amateur photographer Art of Flight by Chelo ,Creative Commons V2.0 videos","Uruguay","und","","","","","","","","","","","","","","","","","","","","",
278,"https://twitter.com/PatekWat3r/statuses/1273084404374679554","https://twitter.com/PatekWat3r/statuses/1273084404374679554","2020-06-16 22:45:49","PatekWat3r","RT @HerodiasPor2: Según datos relevados por #Unicef 152 menores fueron asesinados en 7 años en #Uruguay:  - 7 de cada 10 de esos homicidios…","Según datos relevados por #Unicef 152 menores fueron asesinados en 7 años en #Uruguay:  - 7 de cada 10 de esos homicidios tuvo por víctima a un varón - El 24 % del total de las víctimas tenía entre 0 y 5 años  - El 66 % de ellas adolescentes https://t.co/Ll7XA8KV3m","Twitter Web App",1021053952769634305,"https://pbs.twimg.com/profile_images/1196406587025494016/8wPHqGu1_normal.jpg",12634,301,60,"2018-07-22 11:26:47","𝗕𝗲 𝘀𝘁𝗿𝗼𝗻𝗴𝗲𝗿 𝘁𝗵𝗮𝗻 𝘆𝗼𝘂𝗿 𝗲𝘅𝗰𝘂𝘀𝗲𝘀!","","es","","","","","","","","","","","","","","","","","","","","",
279,"https://twitter.com/toledo_are/statuses/1273084311823155200","https://twitter.com/toledo_are/statuses/1273084311823155200","2020-06-16 22:45:27","toledo_are","RT @Eliana67919239: #RIVERA #URUGUAY  EL PRESIDENTE DE ASSE ÉL @LeoCipriani20 CUMPLIENDO CON SU COMPROMISO  POR EL COVID-19  Se enviaron 10…","#RIVERA #URUGUAY  EL PRESIDENTE DE ASSE ÉL @LeoCipriani20 CUMPLIENDO CON SU COMPROMISO  POR EL COVID-19  Se enviaron 100.000 mil tapa bocas para la población ante la emergencia sanitaria que vive por el covid-19, y ya llegaron a rivera. @ASSEcomunica @tartagliaestefa https://t.co/dTptcOItuh","Twitter for Android",188340606,"https://pbs.twimg.com/profile_images/1178024398617546753/lhbCDRwv_normal.jpg",5181,471,195,"2010-09-08 10:13:20","Ingeniero Agrónomo","Montevideo - Uruguay","es","","","","","","","","","","","","","","","","","","","","",
280,"https://twitter.com/ChelyRobles2677/statuses/1273084266134605824","https://twitter.com/ChelyRobles2677/statuses/1273084266134605824","2020-06-16 22:45:16","ChelyRobles2677","RT @_PedroCuevas_: @AmericoOficial #AVivir #Faltan4días para el #concierto #Cumbia con sentimiento y pasión en una transmisión de #IG #Live…","@AmericoOficial #AVivir #Faltan4días para el #concierto #Cumbia con sentimiento y pasión en una transmisión de #IG #Live y #FacebookLive #AméricoOficial https://t.co/wMUoI9gARX https://t.co/Fbjf5IMfpk #Argentina #Bolivia #Colombia #Ecuador #Uruguay #Peru #USA #Venezuela #Chile https://t.co/FRNVgu9XQI","Twitter for Android",141714083,"https://pbs.twimg.com/profile_images/1254185682655948802/tMsSV33G_normal.jpg",9230,1218,585,"2010-05-08 16:47:27","♫♬Chilena 💓Geminiana Amo la Musica k llega💗@AmericoOficial♫♬♪ @CHAYANNEMUSIC @backstreetboys @losvasquez  🎵🎶VIVRE ET LAISSER VIVRE🎵🎶","Viña del Mar,Chile","es","","","","","","","","","","","","","","","","","","","","",
281,"https://twitter.com/PaulFuenzalida_/statuses/1273084131073802241","https://twitter.com/PaulFuenzalida_/statuses/1273084131073802241","2020-06-16 22:44:44","PaulFuenzalida_","RT @Agencia__SE: Este jueves 18 se realizará hito de inicio del Proyecto de Cooperación #Chile-#Uruguay: #ComunaEnergética y #AcciónClimáti…","Este jueves 18 se realizará hito de inicio del Proyecto de Cooperación #Chile-#Uruguay: #ComunaEnergética y #AcciónClimáticaLocal ⚡ https://t.co/adzXI9Cofi https://t.co/BzTuwMsLSn","Twitter Web App",715398859,"https://abs.twimg.com/sticky/default_profile_images/default_profile_normal.png",251,11,10,"2012-07-24 23:31:04","","","es","","","","","","","","","","","","","","","","","","","","",
282,"https://twitter.com/BadillaVicho/statuses/1273084116020445184","https://twitter.com/BadillaVicho/statuses/1273084116020445184","2020-06-16 22:44:40","BadillaVicho","#Mexico #Guatemala #Honduras #ElSalvador #Nicaragua #CostaRica #Panama #Colombia #Venezuela #Ecuador #Peru #Brasil #Bolivia  #Argentina #Uruguay #Paraguay #Haiti #PuertoRico #RepublicaDominicana https://t.co/CnlF7CWSsh","#Mexico #Guatemala #Honduras #ElSalvador #Nicaragua #CostaRica #Panama #Colombia #Venezuela #Ecuador #Peru #Brasil #Bolivia  #Argentina #Uruguay #Paraguay #Haiti #PuertoRico #RepublicaDominicana https://t.co/CnlF7CWSsh","Twitter for Android",1198318443558297602,"https://pbs.twimg.com/profile_images/1269114522863796230/mf_LgwOj_normal.jpg",12435,381,197,"2019-11-23 14:12:49","Para difundir hasta que me tumben la cuenta","","und","","","","","","","","","","","","","","","","","","","","",
